Start time,End time,Transcript,English Translation
447.200,506.900,แล้วมันโทษนะคะก็คือหมายถึงว่าคือที่ที่อยากทราบหมายถึงว่าเราต้องเลือกเลยสมมุติว่าจะเก็บอย่างต่ำมัน 2 ปีคือต้องเลือกเลยว่าเราจะเอา 5 ปี 10 ปีหรือ 2 ปีหรือว่าเราฝากไปก่อน 2 ปีแล้วหลังจากนั้นแบบถ้าจะเพิ่มก็ค่อยหมายถึงว่าถ้าจะถูกต้องแต่ขั้นต่ำอยู่ที่ 2 ปีแต่ตรงนี้ห้ามออมเกิน 14 ปีเท่านั้นเองเลยค่ะเพราะเราตอนนี้เราเน้นให้ลูกค้าได้รับผลประโยชน์ทุกปีนะคะแต่อันนี้ขออนุญาตสอบถามนิดนึงปัจจุบันที่มีระดับได้มีการใช้จ่ายต่อบัตรเครดิตธนาคารไหนอยู่เป็นประจำมั้ยคะเอ่อมี SCB กับ KTC แต่ว่า SCB ไม่ค่อยได้ใช้อ่ะค่ะมันใช้แค่จ่ายแบบตัดแบบที่ซื้อประกันกับ xwd เฉยๆค่ะเพราะว่าถ้าในส่วนของท่านมีตัวใน 2 ของเค้าเรียกว่าบำบัดเครดิตอยู่แล้วสามารถเก็บออมด้วยกันได้ทั้งรายเดือนแล้วก็รายปีเลยนะคะสะสมแต้มสะสมพลอยได้เช่นกันถ้าเป็นของ KTC,"And then it's a shame. It means that it's the place that I want to know. It means that we have to choose, let's say, to keep it for at least 2 years, that is, we have to choose whether we want to take 5 years, 10 years, or 2 years, or whether we deposit it. Go first for 2 years and after that, if you want to add more, it means that if it's correct, the minimum is 2 years, but here you can't save for more than 14 years. Because right now we focus on getting customers results. It's useful every year, but for this one, please allow me to ask a little. Nowadays, when I have a high level, do I regularly spend with credit cards from any bank? Well, I have SCB and KTC, but I don't use SCB very often. I just use it to pay. The type of cut that you buy insurance with xwd is just because if your part already has 2 of them called credit therapy, you can save together both monthly and yearly. Accumulate gem points such as Same if it's from KTC."
507.100,546.700,ได้เช่นกันค่ะเพราะตัวโครงการนี้ค่ะอย่างน้อยอย่างน้อยๆเลยยังไงเงินก็ไม่ได้หายไปไหนเป็นเงินเก็บเงินออมของเราค่ะแล้วปีนี้พี่เมลดาสุขภาพแข็งแรงดีไม่มีประวัติโรคประจำตัวนะคะเอ่อตอนนี้เฮงแรงดีแต่ว่ามีเรื่องต่อมน้ำเหลืองตัวค่ะแต่ว่าก็คือตรวจอยู่รอบหมุนตัวยินดีเลยเพราะว่าตกลงการที่หนูเรียนผ่านแบบนี้ค่ะเรามาอำนวยความสะดวกให้ลูกค้านะคะตอนนี้ลูกค้าไม่ต้องเดินทางไปตรวจสุขภาพที่โรงพยาบาลหรือไม่ต้องรอเอกสารใดๆแค่รีเช็คคำถามสุขภาพค่าคลอดสั้นๆเพียงเท่านั้นค่ะอย่าเบื้องต้นตรงนี้ขออนุญาตเช็คคำถามสุขภาพ 5 ข้อได้นะคะ,"You can as well because of this project. At least at least the money hasn't gone anywhere. It's our savings. This year, Melada is in good health and has no history of congenital disease. Right now. I'm really lucky, but I have a problem with my lymph nodes, but it was checked around my body. I'm happy because I agreed that I passed the course like this. We're here to facilitate the customers. Now they don't have to travel to the hospital for a health check. Nurse or not, have to wait for any documents. Just re-check the health questions about the delivery fee briefly. Don't be basic here. Please allow me to check the 5 health questions."
549.900,564.900,คำถามข้อไหนไม่สุภาพขออภัยด้วยนะคะค่ะข้อที่ 1 ค่ะท่านเคยถูกปฏิเสธแล้วรับประกันภัยเพิ่มอัตราเบี้ยประกันภัยเปลี่ยนแปลงตั้งแต่ตลาดจะขอประกันภัยในการขอกลับคืนสู่สถานะเดิมและการขอต่ออายุของเรามาจากบริษัทนี้หรือบริษัทอื่นหรือไม่คะ,I apologize for any of the questions that are impolite. Number 1: Have you ever been refused insurance and increased the premium rate since the market has asked for insurance to return to its original status and our renewal request came from this company or another company? Or not?
567.300,604.800,แม่นะคะข้อที่ 2 ไม่สุภาพขออภัยนะคะท่านสิทธิ์หรือเคยเสพยาเสพติดหรือสารเสพติดหรือมีส่วนเกี่ยวข้องกับการค้ายาเสพติดหรือเคยต้องโทษจากคดียาเสพติดหรือไม่คะไม่นะคะข้อที่ 3 ค่ะท่านเคยได้การตอนนี้ฉายรับการรักษาและตั้งข้อสังเกตโดยแพทย์ว่าป่วยเป็น HIV โรคมะเร็งโรคหัวใจโรคหลอดเลือดโรคเบาหวานลดความดันโลหิตสูงโรคหลอดเลือดในสมองโรคฝ่อตัวนั้นโรคโรคหอบหืดโรคเลือดโรคตับโรคไตโรคเอซีพิกัดทางร่างกายหรือไม่คะไม่นะคะข้อที่ 4 ค่ะในระหว่าง 3 ปีที่ผ่านมาท่านเคยรักกันต่อในแฉกเช่นเอ็กซเรย์การตอบสนองใจการตรวจเลือดหรือตอนนั้นมันพิเศษดีๆหรือได้รับการปรึกษาแพทย์ตรวจสุขภาพและครอบครัวรักษาในสถานพยาบาลหรือไม่ค่ะ,"Mother, question number 2 is disrespectful. I apologize. Have you ever taken drugs or substances or been involved in drug trafficking or been convicted of a drug offense? No. No. No. Yes, you have now been screened for treatment and were noted by a doctor as having HIV, cancer, heart disease, vascular disease, diabetes, high blood pressure, cerebrovascular disease, atrophy, asthma, blood disease, liver disease. Is kidney disease AC a physical coordinate? No. No. 4. During the past 3 years, have you ever been in love with each other in different ways, such as x-rays, heart response, blood tests, or was it something special at that time? Have you been consulted by a doctor for a health check and whether your family has been treated in a hospital or not?"
607.400,667.300,ค่ะตอนนี้เป็นในส่วนของในส่วนของต่อมน้ำเหลืองที่พูดเมื่อกี้ถูกต้องไหมคะใช่ค่ะค่ะและในข้อ 5 ค่ะในระหว่าง 6 เดือนที่ผ่านมาน้ำหนักของคุณพี่มิราดามีเพิ่มขึ้นปรับเพิ่มปรับลดบ้างไหมคะง่ายค่ะก็พอๆเดิมค่ะเดี๋ยวตอนนี้ขออนุญาตทราบเป็นในส่วนของน้ำหนักส่วนสูงปัจจุบันค่ะน้ำหนัก 51 ค่ะสูง 170 ค่ะขอพักก่อนค่ะเบื้องต้นใน 2 ครั้งตอนตีเช็คสุขภาพตัวนี้ผ่านเกณฑ์เป็นที่เรียบร้อยแล้วนะคะคุณมีลดาสามารถเข้าร่วมตอบรับสิทธิ์ด้วยกันด้วยกันได้เลยในวันนี้ถ้าหากรับผิดด้วยกันในวันนี้ได้ค่ะไม่เกิน 10 วันทำการจะได้รับในส่วนของหลักฐานการออมฉบับจริงหากตัวนี้ได้รับแล้วอ่านรายละเอียดจะต้องทำการเก็บไว้เป็นหลักฐานการออมได้เลยแต่ถ้าอ่านรายละเอียดแล้วผลประโยชน์ไม่ตรงโทรมาแจ้งเปลี่ยนแปลงแก้ไขได้ตรงนี้ไม่ทราบว่าที่อยู่ปัจจุบันยังเป็นตำบลคลองแหอำเภอหาดใหญ่จังหวัดสงขลาหรือเปล่าค่ะอะไรนะ,"Yes, now it is about the lymph nodes that I spoke about just now, is that correct? Yes, and in point 5, during the past 6 months, has Mr. Mirada's weight increased or decreased? It's easy. It's about the same as before. Now, please allow me to know in terms of my current weight and height. My weight is 51, my height is 170. I'd like to take a break first. Initially, in the 2 times when I did the health check, this one has already passed the criteria. Dear Lada, you can join in accepting your rights together today. If you accept the responsibility together today, within 10 business days you will receive the original proof of savings if this one is received. After reading the details, you must keep them as evidence of savings. But if you read the details and the benefits don't match, you can call to report changes here. I don't know that the current address is still Khlong Hae Subdistrict, Amphoe. Hat Yai, Songkhla Province or what?"
667.400,685.300,คะใช่ค่ะขออนุญาตจัดส่งเป็นที่อยู่นี้เลยนะคะเอออันนี้จะจัดส่งภายใน 10 วันใช่ไหมคะใช่ค่ะไม่เกิน 10 วันทำการถ้าจะขอเปลี่ยนพอดีว่าตอนนี้อยู่ต่างจังหวัดกันนะคะอ๋อจัดส่งไปที่ไหนดีคะ,"Yes, please allow delivery to this address. Yes, this will be delivered within 10 days, right? Yes, no more than 10 business days. If you want to change it, I'm in another province right now. Oh, delivery. Where should I go?"
692.400,697.400,วีรันดาสุขุมวิท 117 117 นะคะ,Veranda Sukhumvit 117 117
699.900,701.300,ต่อได้เลยค่ะ,You can continue.
