Start time,End time,Transcript,English Translation
11.400,27.100,ฮัลโหลค่ะสวัสดีค่ะขออนุญาตค่ะติดต่อกลับจากบริษัทไทยพาณิชย์โปรเทคค่ะตอนนี้สาขาข้อมูลเพิ่มเติมได้สักครู่นะคะค่ะตอนนี้ตรวจพบเมื่อไหร่คะ,"Hello, hello. I would like permission to contact you back from Siam Commercial Bank Protech. Please give me more information at this branch in a moment. Now, when was it detected?"
45.500,49.700,หรือว่าปีไหนเอ่ยที่ผ่านมาค่ะ,Or what year was it in the past?
52.600,62.100,ที่โรงพยาบาลไหนคะคุณพี่,At which hospital?
62.700,66.600,โรงพยาบาลรักษายังไงบ้างคะ,How does the hospital treat you?
67.600,80.800,วันที่ 5 พฤษภาคมแต่ตอนนั้นไม่ได้มีการโรงพยาบาลเนอะมีการนอนโรงพยาบาลไหมเอ่ยมีอะไรนะคะมีการนอนโรงพยาบาลไหมคะ,"It was May 5th, but there was no hospital at that time, was there a hospital stay? Is there something wrong? Was there a hospital stay?"
85.200,135.700,แจ้งข้อมูลเพิ่มเติมอีกนิดนึงค่ะพอดีอาจารย์ขอคำยอมครั้งก่อนคือมันขาดไปประมาณ 1 ประโยคเนาะขออนุญาตขอเพิ่มได้ดีมากๆคุณลูกค้าค่ะรับรองว่าข้อมูลส่วนบุคคลที่บุคคลอื่นที่บุคคลอื่นที่ลูกค้าให้แก่ fwd นั้นถูกต้องสมบูรณ์โดยได้รับความยินยอมหรือสามารถอาศัยหาทางกฎหมายในการใช้และเปิดเผยข้อมูลโดยรวมถึงแจ้งให้บุคคลอื่นรับทราบนโยบายคุ้มครองข้อมูลส่วนบุคคลของ fbd แล้วเราลองว่า swe และสามารถคปภสามารถเก็บรวบรวมใช้และเปิดเผยข้อมูลส่วนบุคคลตามวัตถุประสงค์และนโยบายของ evd และสำนักงานคปภที่เกี่ยวข้องกับการประกันภัยยินยอมนะคะหากรณีการเวนคืนกรมธรรม์หรือนำเงินออกก่อนพบกันค่ะจะได้รับเงินทุนเงินการเงินทุนน้อยกว่าจำนวนเบี้ยที่ชำระเข้าไปซึ่งถ้าเขาจะได้รับการตรังเวนคืนมูลค่าเป็นนานๆและส่วนใหญ่จะสิ้นสุดลงทันทีนะคะอ่าตอนนี้ข้อมูลทั้งหมดเป็นที่เดิมและขอบพระคุณมากๆนะคะนะคะสวัสดีค่ะ,"Please give me a little more information. The teacher asked for consent last time. It was missing about 1 sentence. Please allow me to add more. It's very good, customer. I guarantee that the personal information that other people give to fwd is Is completely accurate, with consent or can rely on the law to use and disclose information, including informing other people of fbd's personal data protection policy. We try to see that swe and OIC can collect and use and disclose personal information according to the objectives and policies of evd and the OIC related to insurance. I agree that if there is a case of surrendering the policy or taking the money out before meeting, the funds will be received less than the amount of the premium. Paid into which if he will receive expropriation of value for a long time and most of the time it will end immediately. Now all the information is in the same place and thank you very much. Hello."
